{
  "id": "srd-0032",
  "date": "2026-10-20",
  "difficulty": "medium",
  "language": "python",
  "estimatedMinutes": 15,
  "snippet": {
    "files": [
      {
        "name": "fetch.py",
        "code": "import requests\nfrom flask import request, Response\n\n@app.route(\"/fetch\")\ndef fetch():\n    # Proxy a remote image so pages can embed it over https.\n    url = request.args.get(\"url\")\n    r = requests.get(url, timeout=5)\n    return Response(r.content, content_type=r.headers.get(\"Content-Type\"))",
        "notes": {
          "4": "The /fetch proxy route.",
          "7": "Reads the `url` query parameter — attacker-controlled.",
          "8": "The server fetches that URL (requests follows redirects by default).",
          "9": "Returns the fetched bytes and content type to the client."
        }
      }
    ]
  },
  "stages": {
    "line": {
      "file": "fetch.py",
      "line": 8,
      "yellowRadius": 1,
      "maxGuesses": 5
    },
    "bugClass": {
      "answer": "ssrf",
      "options": [
        "ssrf",
        "open-redirect",
        "path-traversal",
        "xxe",
        "idor",
        "command-inj"
      ]
    },
    "why": {
      "answerIndex": 0,
      "options": [
        {
          "label": "`url` is user-controlled and fetched by the server, so it can reach internal-only hosts (cloud metadata, localhost services) and the body is returned to the attacker"
        },
        {
          "label": "`requests.get` without a session is inefficient",
          "whyWrong": "Efficiency is irrelevant to the SSRF."
        },
        {
          "label": "`r.content` loads the whole body into memory, risking exhaustion",
          "whyWrong": "A possible DoS, but not why this is SSRF; the destination being attacker-chosen is."
        }
      ]
    },
    "fix": {
      "answerIndex": 1,
      "options": [
        {
          "label": "Reject urls containing 'localhost' or '127.0.0.1'",
          "diff": "+    if \"localhost\" in url or \"127.0.0.1\" in url: abort(400)",
          "whyWrong": "Alternate IP encodings, other private ranges, and DNS rebinding bypass substring checks."
        },
        {
          "label": "Allow only http/https, resolve the host and reject private/loopback/link-local ranges, and disable redirects",
          "diff": "-    r = requests.get(url, timeout=5)\n+    validate_public_url(url)        # scheme check + resolve + block RFC1918/loopback/link-local\n+    r = requests.get(url, timeout=5, allow_redirects=False)"
        },
        {
          "label": "Only return the body when Content-Type is an image",
          "diff": "+    if not r.headers.get(\"Content-Type\",\"\").startswith(\"image/\"): abort(400)",
          "whyWrong": "The internal request already happened; blind SSRF and timing still leak information."
        },
        {
          "label": "Lower the timeout to 2 seconds",
          "diff": "-    r = requests.get(url, timeout=5)\n+    r = requests.get(url, timeout=2)",
          "whyWrong": "A timeout limits duration, not which host is contacted."
        }
      ]
    }
  },
  "source": {
    "origin": "original",
    "license": "CC0-1.0",
    "attribution": "SourceReadle original"
  },
  "training": {
    "exploit": "Request `/fetch?url=http://169.254.169.254/latest/meta-data/iam/security-credentials/` to read cloud credentials, or `http://127.0.0.1:8080/admin` to reach an internal admin panel. Because `requests` follows redirects by default, a public URL that 302s to an internal one also works.",
    "concepts": [
      "CWE-918",
      "OWASP A10:2021"
    ],
    "hints": {
      "line": "Where does the server fetch a user-supplied address?",
      "bugClass": "The server reaches a destination the user chose.",
      "why": "What can the server's network position reach that the client can't?",
      "fix": "Validate the resolved host and forbid redirects."
    }
  },
  "writeup": {
    "summary": "`fetch` requests any URL the user supplies and returns the body, from the server's network position — SSRF. Attackers target cloud metadata and internal services to steal credentials and data, and default redirect-following lets a public URL pivot inward. The fix validates the scheme, resolves the host and rejects private/loopback/link-local ranges, and disables redirects. Blocklisting hostnames, filtering by content type, or tuning the timeout don't prevent the internal request.",
    "readNext": [
      {
        "label": "OWASP SSRF Prevention Cheat Sheet",
        "url": "https://cheatsheetseries.owasp.org/cheatsheets/Server_Side_Request_Forgery_Prevention_Cheat_Sheet.html"
      }
    ]
  }
}
