{
  "id": "srd-0013",
  "date": "2026-10-13",
  "difficulty": "easy",
  "language": "php",
  "estimatedMinutes": 5,
  "snippet": {
    "files": [
      {
        "name": "login.php",
        "code": "<?php\nfunction find_user($conn, $email) {\n    $sql = \"SELECT id, name FROM users WHERE email = '\" . $email . \"'\";\n    $res = mysqli_query($conn, $sql);\n    return mysqli_fetch_assoc($res);\n}\n\n$user = find_user($conn, $_GET[\"email\"]);\necho json_encode($user);",
        "notes": {
          "3": "Builds the SQL query by concatenating `$email` directly into the string.",
          "4": "Runs the assembled query against the database.",
          "5": "Returns the first matching row as an associative array.",
          "8": "Reads `email` from the query string and looks the user up."
        }
      }
    ]
  },
  "stages": {
    "line": {
      "file": "login.php",
      "line": 3,
      "yellowRadius": 1,
      "maxGuesses": 5
    },
    "bugClass": {
      "answer": "sqli",
      "options": [
        "sqli",
        "code-inj",
        "command-inj",
        "idor",
        "path-traversal"
      ]
    },
    "why": {
      "answerIndex": 2,
      "options": [
        {
          "label": "`mysqli_fetch_assoc` only returns one row, hiding duplicates",
          "whyWrong": "Row count is irrelevant; the attacker controls the query itself."
        },
        {
          "label": "Reading from `$_GET` is always unsafe and should never be done",
          "whyWrong": "Reading input is fine; the flaw is concatenating it into SQL without parameterization."
        },
        {
          "label": "`$email` is concatenated into the SQL text, so input is parsed as part of the query, not as data"
        }
      ]
    },
    "fix": {
      "answerIndex": 1,
      "options": [
        {
          "label": "Wrap $email in addslashes()",
          "diff": "-    $sql = \"...WHERE email = '\" . $email . \"'\";\n+    $sql = \"...WHERE email = '\" . addslashes($email) . \"'\";",
          "whyWrong": "addslashes is incomplete and bypassable under some charsets; escaping is not a substitute for parameters."
        },
        {
          "label": "Use a prepared statement with a bound parameter",
          "diff": "-    $sql = \"SELECT id, name FROM users WHERE email = '\" . $email . \"'\";\n-    $res = mysqli_query($conn, $sql);\n+    $stmt = mysqli_prepare($conn, \"SELECT id, name FROM users WHERE email = ?\");\n+    mysqli_stmt_bind_param($stmt, \"s\", $email);\n+    mysqli_stmt_execute($stmt);"
        },
        {
          "label": "Apply htmlspecialchars() to $email",
          "diff": "+    $email = htmlspecialchars($email);",
          "whyWrong": "HTML-encoding is the wrong context; it doesn't neutralize SQL metacharacters."
        },
        {
          "label": "Cast $email to a string",
          "diff": "+    $email = (string)$email;",
          "whyWrong": "It is already a string; this changes nothing about how it's parsed by the database."
        }
      ]
    }
  },
  "source": {
    "origin": "original",
    "license": "CC0-1.0",
    "attribution": "SourceReadle original"
  },
  "training": {
    "exploit": "Request `?email=' OR '1'='1` and the WHERE clause becomes always-true, returning the first user. `?email=' UNION SELECT password, name FROM users -- ` pulls data out of other columns/tables.",
    "concepts": [
      "CWE-89",
      "OWASP A03:2021"
    ],
    "hints": {
      "line": "Where does input become part of a command's text?",
      "bugClass": "The sink is a database query.",
      "why": "What does the database parse the email as?",
      "fix": "Send the value as a bound parameter, not query text."
    }
  },
  "writeup": {
    "summary": "`$email` is concatenated straight into the SQL string, so a crafted value changes the query's structure — the classic SQL injection. An attacker reads arbitrary rows with `UNION SELECT` or bypasses the lookup with a tautology. Prepared statements with bound parameters send the value as data the database never parses as SQL; escaping functions are weaker and context-fragile.",
    "readNext": [
      {
        "label": "PHP: mysqli prepared statements",
        "url": "https://www.php.net/manual/en/mysqli.quickstart.prepared-statements.php"
      },
      {
        "label": "OWASP SQL Injection Prevention",
        "url": "https://cheatsheetseries.owasp.org/cheatsheets/SQL_Injection_Prevention_Cheat_Sheet.html"
      }
    ]
  }
}
